paper_id,expected_title,doi,pdf_path,manifest_status,source_used,pdf_url,extracted_title_or_first_text,title_similarity,doi_found_in_pdf,audit_status,reason
REFINE-0185,"Brain morphometry points to emerging patterns of psychosis, depression, and anxiety vulnerability over a 2-year period in childhood",10.1017/s0033291721005304,data/pdfs/REFINE-0185.pdf,downloaded,openalex_landing_page,https://www.cambridge.org/core/services/aop-cambridge-core/content/view/867DF63762DEF289F6829258030CCC87/S0033291721005304a.pdf/div-class-title-brain-morphometry-points-to-emerging-patterns-of-psychosis-depression-and-anxiety-vulnerability-over-a-2-year-period-in-childhood-div.pdf,Brain morphometry points to emerging,100.0,10.1017/S0033291721005304,validated,DOI 10.1017/S0033291721005304 found in PDF matches expected DOI 10.1017/s0033291721005304
REFINE-0186,Correlation between gray matter volume in the temporal lobe and depressive symptoms in patients with Alzheimer’s disease,10.1016/j.neulet.2013.05.021,data/pdfs/REFINE-0186.pdf,landing_page_unresolved,none,,,0.0,,missing_pdf,PDF file not found on disk
REFINE-0187,Apathy in persons living with HIV disease: A systematic narrative review,10.1016/j.jad.2024.01.016,data/pdfs/REFINE-0187.pdf,landing_page_unresolved,none,,,0.0,,missing_pdf,PDF file not found on disk
REFINE-0188,Association of major depressive disorder with altered functional brain response during anticipation and processing of heat pain,10.1001/archpsyc.65.11.1275,data/pdfs/REFINE-0188.pdf,publisher_403,none,https://doi.org/10.1001/archpsyc.65.11.1275,,0.0,,missing_pdf,PDF file not found on disk
REFINE-0189,Amygdala grey matter volume increase in gambling disorder with depression symptoms of clinical relevance: A voxel-based morphometry study,10.1080/14459795.2018.1452276,data/pdfs/REFINE-0189.pdf,publisher_403,none,https://doi.org/10.1080/14459795.2018.1452276,,0.0,,missing_pdf,PDF file not found on disk
REFINE-0190,Anatomic location and laterality of MRI signal hyperintensities in late-life depression,10.1016/s0022-3999(02)00425-7,data/pdfs/REFINE-0190.pdf,landing_page_unresolved,none,,,0.0,,missing_pdf,PDF file not found on disk
REFINE-0191,Antidepressant Exposure May Protect Against Decrement in Frontal Gray Matter Volumes in Geriatric Depression,10.4088/jcp.v66n0801,data/pdfs/REFINE-0191.pdf,landing_page_unresolved,none,,,0.0,,missing_pdf,PDF file not found on disk
REFINE-0192,Development of disordered eating behaviors and comorbid depressive symptoms in adolescence: Neural and psychopathological predictors,10.1016/j.biopsych.2020.06.003,data/pdfs/REFINE-0192.pdf,downloaded,openalex,https://kclpure.kcl.ac.uk/ws/files/132753533/Development_of_disordered_eating_ZHANG_Acc3JunEpub10Jun2020_GREEN_AAM.pdf,King’s Research Portal,50.0,10.1016/j.biopsych.2020.06.003,validated,DOI 10.1016/j.biopsych.2020.06.003 found in PDF matches expected DOI 10.1016/j.biopsych.2020.06.003
REFINE-0193,Brain density in depression: Methodological and psychopathological aspects,10.1111/j.1600-0447.1988.tb06392.x,data/pdfs/REFINE-0193.pdf,publisher_403,none,https://doi.org/10.1111/j.1600-0447.1988.tb06392.x,,0.0,,missing_pdf,PDF file not found on disk
REFINE-0194,Structural and functional improvement of amygdala sub-regions in postpartum depression after acupuncture,10.3389/fnhum.2023.1163746,data/pdfs/REFINE-0194.pdf,publisher_403,none,https://doaj.org/article/e966d556c9d24583bb63abfa6674d2f1,,0.0,,missing_pdf,PDF file not found on disk
REFINE-0195,Hippocampal and parahippocampal volume and function predict antidepressant response in patients with major depression: A multimodal neuroimaging study,10.1177/02698811231190859,data/pdfs/REFINE-0195.pdf,publisher_403,none,https://journals.sagepub.com/doi/pdf/10.1177/02698811231190859,,0.0,,missing_pdf,PDF file not found on disk
REFINE-0196,Bidirectional associations between perinatal allopregnanolone and depression severity with postpartum gray matter volume in adult women,10.1111/acps.13723,data/pdfs/REFINE-0196.pdf,publisher_403,none,https://doi.org/10.1111/acps.13723,,0.0,,missing_pdf,PDF file not found on disk
REFINE-0197,Neutrophil to lymphocyte ratio is a transdiagnostic biomarker of depression and structural and functional brain alterations in older adults,10.1016/j.jneuroim.2022.577831,data/pdfs/REFINE-0197.pdf,pmc_fulltext_no_pdf,none,,,0.0,,missing_pdf,PDF file not found on disk
REFINE-0198,Neuromodulation in response to electroconvulsive therapy in schizophrenia and major depression,10.1016/j.brs.2017.01.578,data/pdfs/REFINE-0198.pdf,publisher_403,none,https://doaj.org/article/2f52722b285c42dbb9f2745274457abb,,0.0,,missing_pdf,PDF file not found on disk
REFINE-0199,Anatomical correlates of quality of life: Evidence from voxel-based morphometry,10.1002/hbm.22294,data/pdfs/REFINE-0199.pdf,publisher_403,none,https://onlinelibrary.wiley.com/doi/pdfdirect/10.1002/hbm.22294?download=true,,0.0,,missing_pdf,PDF file not found on disk
REFINE-0200,Brain structures and functional connectivity in neglected children with no other types of maltreatment,10.1016/j.neuroimage.2024.120589,data/pdfs/REFINE-0200.pdf,publisher_403,none,https://doaj.org/article/65a2ca2692a14d7da984eaa7f5954827,,0.0,,missing_pdf,PDF file not found on disk
REFINE-0201,Hyperconnectivity and altered interactions of a nucleus accumbens network in post-stroke depression,10.1093/braincomms/fcac281,data/pdfs/REFINE-0201.pdf,publisher_403,none,https://academic.oup.com/braincomms/article-pdf/4/6/fcac281/47161022/fcac281.pdf,,0.0,,missing_pdf,PDF file not found on disk
REFINE-0202,Neuroanatomical predictors of response to subcallosal cingulate deep brain stimulation for treatment-resistant depression,10.1503/jpn.180207,data/pdfs/REFINE-0202.pdf,publisher_403,none,https://doi.org/10.1503/jpn.180207,,0.0,,missing_pdf,PDF file not found on disk
REFINE-0203,Effects of the BDNF Val66Met Polymorphism on Gray Matter Volume in Typically Developing Children and Adolescents,10.1093/cercor/bhw020,data/pdfs/REFINE-0203.pdf,publisher_403,none,https://academic.oup.com/cercor/article-pdf/26/4/1795/7005145/bhw020.pdf,,0.0,,missing_pdf,PDF file not found on disk
REFINE-0204,"Comparison of brain structural variables, neuropsychological factors, and treatment outcome in early-onset versus late-onset late-life depression",10.1016/j.jagp.2013.02.005,data/pdfs/REFINE-0204.pdf,pmc_fulltext_no_pdf,none,,,0.0,,missing_pdf,PDF file not found on disk
REFINE-0205,Neural Correlates of the Cortisol Awakening Response in Humans,10.1038/npp.2015.77,data/pdfs/REFINE-0205.pdf,invalid_pdf_title_mismatch,none,,,0.0,,missing_pdf,PDF file not found on disk
REFINE-0206,Patterns of reduced cortical thickness in late-life depression and relationship to psychotherapeutic response,10.1016/j.jagp.2013.01.013,data/pdfs/REFINE-0206.pdf,publisher_403,none,https://escholarship.org/uc/item/07s2k1hk,,0.0,,missing_pdf,PDF file not found on disk
REFINE-0207,Prefrontal cortex and amygdala volume in first minor or major depressive episode after cancer diagnosis,10.1016/j.biopsych.2005.08.018,data/pdfs/REFINE-0207.pdf,landing_page_unresolved,none,,,0.0,,missing_pdf,PDF file not found on disk
REFINE-0208,Neuropsychological functioning and MRI signal hyperintensities in geriatric depression,,data/pdfs/REFINE-0208.pdf,publisher_403,none,https://www.ahajournals.org/doi/pdf/10.1161/STR.0b013e3182299496,,0.0,,missing_pdf,PDF file not found on disk
REFINE-0209,Orbitofrontal cortex volume in late life depression: Influence of hyperintense lesions and genetic polymorphisms,10.1017/s0033291707000128,data/pdfs/REFINE-0209.pdf,downloaded,openalex_landing_page,https://www.cambridge.org/core/services/aop-cambridge-core/content/view/E9DD287BC3CAE443C9C7DCD4528F25AC/S0033291707000128a.pdf/div-class-title-orbitofrontal-cortex-volume-in-late-life-depression-influence-of-hyperintense-lesions-and-genetic-polymorphisms-div.pdf,Orbitofrontal cortex volume in late life,100.0,10.1017/S0033291707000128,validated,DOI 10.1017/S0033291707000128 found in PDF matches expected DOI 10.1017/s0033291707000128
REFINE-0210,Cortical changes associated with depression and antidepressant use in Alzheimer and Lewy body dementia: An MRI surface-based morphometric study,10.1016/j.jagp.2013.02.004,data/pdfs/REFINE-0210.pdf,publisher_403,none,http://www.ajgponline.org/article/S106474811300122X/pdf,,0.0,,missing_pdf,PDF file not found on disk
REFINE-0211,Major Depression and Suicidality Following Brain Injury,,data/pdfs/REFINE-0211.pdf,publisher_403,none,http://www.ajpmonline.org/article/S0749379798000178/pdf,,0.0,,missing_pdf,PDF file not found on disk
REFINE-0212,In vivo structural and functional abnormalities of the striatums is related to decreased astrocytic BDNF in Itpr2-/- mice exhibiting depressive-like behavior,10.1155/2020/8830670,data/pdfs/REFINE-0212.pdf,publisher_403,none,https://downloads.hindawi.com/journals/np/2020/8830670.pdf,,0.0,,missing_pdf,PDF file not found on disk
REFINE-0213,Temporal lobe epilepsy and affective disorders: The role of the subgenual anterior cingulate cortex,10.1136/jnnp-2013-306966,data/pdfs/REFINE-0213.pdf,downloaded,openalex,https://jnnp.bmj.com/content/jnnp/86/2/144.full.pdf,Temporal lobe epilepsy and affective disorders:,100.0,10.1136/jnnp-2013-306966,validated,DOI 10.1136/jnnp-2013-306966 found in PDF matches expected DOI 10.1136/jnnp-2013-306966
REFINE-0214,"Early childhood cumulative risk is associated with decreased global brain measures, cortical thickness, and cognitive functioning in school‐age children",10.1002/dev.21956,data/pdfs/REFINE-0214.pdf,publisher_403,none,https://doi.org/10.1002/dev.21956,,0.0,,missing_pdf,PDF file not found on disk
REFINE-0215,Depression symptoms moderate the relationship between gray matter volumes and cognitive function in patients with mild cognitive impairment,10.1016/j.jpsychires.2022.05.017,data/pdfs/REFINE-0215.pdf,landing_page_unresolved,none,,,0.0,,missing_pdf,PDF file not found on disk
REFINE-0216,Evaluation in late-life depression of intercellular adhesion molecule-1 expression in the dorsolateral prefrontal cortex,10.1176/appi.ajp.157.10.1682,data/pdfs/REFINE-0216.pdf,publisher_403,none,https://doi.org/10.1176/appi.ajp.157.10.1682,,0.0,,missing_pdf,PDF file not found on disk
REFINE-0217,Aberrant topographical organization in gray matter structural network in late life depression: A graph theoretical analysis,10.1017/s104161021300149x,data/pdfs/REFINE-0217.pdf,landing_page_unresolved,none,,,0.0,,missing_pdf,PDF file not found on disk
REFINE-0218,Localizing gray matter deficits in late-onset depression using computational cortical pattern matching methods,10.1176/appi.ajp.161.11.2091,data/pdfs/REFINE-0218.pdf,publisher_403,none,https://doi.org/10.1176/appi.ajp.161.11.2091,,0.0,,missing_pdf,PDF file not found on disk
REFINE-0219,Anterior cingulate volume reduction in adolescents with borderline personality disorder and co-morbid major depression,10.1016/j.jpsychires.2010.11.011,data/pdfs/REFINE-0219.pdf,landing_page_unresolved,none,,,0.0,,missing_pdf,PDF file not found on disk
REFINE-0220,Regional Gray Matter Changes Are Associated with Cognitive Deficits in Remitted Geriatric Depression: An Optimized Voxel-Based Morphometry Study,10.1016/j.biopsych.2008.04.032,data/pdfs/REFINE-0220.pdf,landing_page_unresolved,none,,,0.0,,missing_pdf,PDF file not found on disk
REFINE-0221,Electroconvulsive therapy response in late-life depression unaffected by age-related brain changes,10.1016/j.jad.2019.03.055,data/pdfs/REFINE-0221.pdf,invalid_pdf,none,,,0.0,,missing_pdf,PDF file not found on disk
REFINE-0222,Genetic vulnerability to affective psychopathology in childhood: A combined voxel-based morphometry and functional magnetic resonance imaging study,10.1016/j.biopsych.2009.01.033,data/pdfs/REFINE-0222.pdf,publisher_403,none,http://hdl.handle.net/11577/2381162,,0.0,,missing_pdf,PDF file not found on disk
REFINE-0223,Lifelong impact of extreme stress on the human brain: Holocaust survivors study,10.1016/j.ynstr.2021.100318,data/pdfs/REFINE-0223.pdf,publisher_403,none,https://doaj.org/article/3239851d5cb94df38e34d51424ee45b6,,0.0,,missing_pdf,PDF file not found on disk
REFINE-0224,Cortical thickness and hippocampal volume in vascular and non-vascular depressed patients,10.3389/fpsyt.2021.697489,data/pdfs/REFINE-0224.pdf,downloaded,openalex,https://www.frontiersin.org/articles/10.3389/fpsyt.2021.697489/pdf,Frontiers in Psychiatry | www.frontiersin.org 1 July 2021 | Volume 12 | Article 697489,43.8,10.3389/fpsyt.2021.697489,validated,DOI 10.3389/fpsyt.2021.697489 found in PDF matches expected DOI 10.3389/fpsyt.2021.697489
REFINE-0225,Determining the effects of LLD and MCI on brain decline according to machine learning and a structural covariance network analysis,10.1016/j.jpsychires.2020.04.011,data/pdfs/REFINE-0225.pdf,landing_page_unresolved,none,,,0.0,,missing_pdf,PDF file not found on disk
REFINE-0226,White matter and subcortical gray matter lesion volume changes and late-life depression outcome: A 4-year magnetic resonance imaging study,10.1017/s1041610205002796,data/pdfs/REFINE-0226.pdf,landing_page_unresolved,none,,,0.0,,missing_pdf,PDF file not found on disk
REFINE-0227,Neurostructural impact of co-occurring anxiety in pediatric patients with major depressive disorder: A voxel-based morphometry study,10.1016/j.jad.2014.09.004,data/pdfs/REFINE-0227.pdf,landing_page_unresolved,none,,,0.0,,missing_pdf,PDF file not found on disk
REFINE-0228,Effects of antipsychotic medication on brain structure in patients with major depressive disorder and psychotic features: Neuroimaging findings in the context of a randomized placebo-controlled clinical trial,10.1001/jamapsychiatry.2020.0036,data/pdfs/REFINE-0228.pdf,publisher_403,none,https://jamanetwork.com/journals/jamapsychiatry/articlepdf/2761879/jamapsychiatry_voineskos_2020_oi_200002.pdf,,0.0,,missing_pdf,PDF file not found on disk
REFINE-0229,Effects of parental emotional warmth on the relationship between regional gray matter volume and depression-related personality traits,10.1080/17470919.2016.1174150,data/pdfs/REFINE-0229.pdf,publisher_403,none,https://doi.org/10.1080/17470919.2016.1174150,,0.0,,missing_pdf,PDF file not found on disk
REFINE-0230,"Homer1a protein expression in schizophrenia, bipolar disorder, and major depression",10.1007/s00702-017-1776-x,data/pdfs/REFINE-0230.pdf,landing_page_unresolved,none,,,0.0,,missing_pdf,PDF file not found on disk
REFINE-0231,"Association between change in brain gray matter volume, cognition, and depression severity: Pre- and post- antidepressant pharmacotherapy for late-life depression",10.1016/j.jpsychires.2017.08.002,data/pdfs/REFINE-0231.pdf,pmc_fulltext_no_pdf,none,,,0.0,,missing_pdf,PDF file not found on disk
REFINE-0232,Early childhood depression and alterations in the trajectory of gray matter maturation in middle childhood and early adolescence,10.1001/jamapsychiatry.2015.2356,data/pdfs/REFINE-0232.pdf,publisher_403,none,https://jamanetwork.com/journals/jamapsychiatry/articlepdf/2473514/yoi150072.pdf,,0.0,,missing_pdf,PDF file not found on disk
REFINE-0233,Effect of non-invasive spinal cord stimulation in unmedicated adults with major depressive disorder: A pilot randomized controlled trial and induced current flow pattern,10.1038/s41380-023-02349-9,data/pdfs/REFINE-0233.pdf,downloaded,openalex,https://www.nature.com/articles/s41380-023-02349-9.pdf,Effect of non-invasive spinal cord stimulation in unmedicated,100.0,10.1038/s41380-023-02349-9,validated,DOI 10.1038/s41380-023-02349-9 found in PDF matches expected DOI 10.1038/s41380-023-02349-9
REFINE-0234,GWAS-identified risk variants for major depressive disorder: Preliminary support for an association with late-life depressive symptoms and brain structural alterations,10.1016/j.euroneuro.2015.08.022,data/pdfs/REFINE-0234.pdf,downloaded,semantic_scholar,https://hal.umontpellier.fr/hal-02400306/file/Ancelin_21.pdf,for the deposit and dissemination of scientific re-,50.0,10.1016/j.euroneuro.2015.08.022⟩.,validated,DOI 10.1016/j.euroneuro.2015.08.022⟩. found in PDF matches expected DOI 10.1016/j.euroneuro.2015.08.022
REFINE-0235,Magnetic resonance imaging in late-life depression: Multimodal examination of network disruption,,data/pdfs/REFINE-0235.pdf,publisher_403,none,https://academic.oup.com/eurheartj/article-pdf/40/3/237/31623821/ehy462.pdf,,0.0,,missing_pdf,PDF file not found on disk
REFINE-0236,The association between gray matter volume in the hippocampal subfield and antidepressant efficacy mediated by abnormal dynamic functional connectivity,10.1038/s41598-024-56866-w,data/pdfs/REFINE-0236.pdf,downloaded,openalex,https://www.nature.com/articles/s41598-024-56866-w.pdf,The association between gray,100.0,10.1038/s41598-024-56866-w,validated,DOI 10.1038/s41598-024-56866-w found in PDF matches expected DOI 10.1038/s41598-024-56866-w
REFINE-0237,A controlled study of MRI signal hyperintensities in older depressed patients with and without hypertension,10.1046/j.1532-5415.2001.49240.x,data/pdfs/REFINE-0237.pdf,publisher_403,none,https://doi.org/10.1046/j.1532-5415.2001.49240.x,,0.0,,missing_pdf,PDF file not found on disk
REFINE-0238,C-reactive protein and the kynurenic acid to quinolinic acid ratio are independently associated with White matter integrity in major depressive disorder,10.1016/j.bbi.2022.07.011,data/pdfs/REFINE-0238.pdf,publisher_403,none,https://www.sciencedirect.com/science/article/am/pii/S0889159122001854,,0.0,,missing_pdf,PDF file not found on disk
REFINE-0239,Gray matter substrates of depressive and anxiety symptoms in idiopathic REM sleep behavior disorder,10.1016/j.parkreldis.2018.12.020,data/pdfs/REFINE-0239.pdf,landing_page_unresolved,none,,,0.0,,missing_pdf,PDF file not found on disk
REFINE-0240,Neuroimaging features of depression–frailty phenotype in older adults: A pilot study,10.1017/s1041610223000066,data/pdfs/REFINE-0240.pdf,pmc_pdf_not_found,none,,,0.0,,missing_pdf,PDF file not found on disk
REFINE-0241,Plasma biosignature and brain pathology related to persistent cognitive impairment in late-life depression,10.1038/mp.2014.76,data/pdfs/REFINE-0241.pdf,invalid_pdf,none,,,0.0,,missing_pdf,PDF file not found on disk
REFINE-0242,Local neuroanatomical and tract-based proxies of optimal subcallosal cingulate deep brain stimulation,10.1016/j.brs.2023.08.014,data/pdfs/REFINE-0242.pdf,publisher_403,none,https://doaj.org/article/df549690733a4725af31a5ab93aba936,,0.0,,missing_pdf,PDF file not found on disk
REFINE-0243,"Reduced frontal brain volume in non-treatment-seeking cocaine-dependent individuals: Exploring the role of impulsivity, depression, and smoking",10.3389/fnhum.2014.00007,data/pdfs/REFINE-0243.pdf,downloaded,openalex,https://www.frontiersin.org/articles/10.3389/fnhum.2014.00007/pdf,Reduced frontal brain volume in non-treatment-seeking,100.0,10.3389/fnhum.2014.00007,validated,DOI 10.3389/fnhum.2014.00007 found in PDF matches expected DOI 10.3389/fnhum.2014.00007
REFINE-0244,Commonalities and differences in ECT-induced gray matter volume change between depression and schizophrenia,10.1016/j.nicl.2023.103429,data/pdfs/REFINE-0244.pdf,publisher_403,none,https://doaj.org/article/d7e4cc5c449e415e88ae8a2ca0835e8c,,0.0,,missing_pdf,PDF file not found on disk
REFINE-0245,"Brain alterations in adult ADHD: Effects of gender, treatment and comorbid depression",10.1016/j.euroneuro.2013.11.011,data/pdfs/REFINE-0245.pdf,repository_landing_page,none,,,0.0,,missing_pdf,PDF file not found on disk
REFINE-0246,31Phosphorus magnetic resonance spectroscopy study of tissue specific changes in high energy phosphates before and after sertraline treatment of geriatric depression,10.1002/gps.2230,data/pdfs/REFINE-0246.pdf,publisher_403,none,https://onlinelibrary.wiley.com/doi/pdfdirect/10.1002/gps.2230,,0.0,,missing_pdf,PDF file not found on disk
REFINE-0247,Altered connectivity of the anterior cingulate and the posterior superior temporal gyrus in a longitudinal study of later-life depression,10.3389/fnagi.2018.00031,data/pdfs/REFINE-0247.pdf,downloaded,openalex,https://www.frontiersin.org/articles/10.3389/fnagi.2018.00031/pdf,Altered Connectivity of the Anterior,100.0,10.3389/fnagi.2018.00031,validated,DOI 10.3389/fnagi.2018.00031 found in PDF matches expected DOI 10.3389/fnagi.2018.00031
REFINE-0248,"Frontal-subcortical volumetric deficits in single episode, medication-naïve depressed patients and the effects of 8 weeks fluoxetine treatment: A VBM-DARTEL study",10.1371/journal.pone.0079055,data/pdfs/REFINE-0248.pdf,downloaded,openalex,https://journals.plos.org/plosone/article/file?id=10.1371/journal.pone.0079055&type=printable,"Frontal-Subcortical Volumetric Deficits in Single Episode,",100.0,10.1371/journal.pone.0079055,validated,DOI 10.1371/journal.pone.0079055 found in PDF matches expected DOI 10.1371/journal.pone.0079055
REFINE-0249,Differences in cerebral structure associated with depressive symptoms in the elderly with Alzheimer’s disease,10.3389/fnagi.2020.00107,data/pdfs/REFINE-0249.pdf,downloaded,semantic_scholar,https://www.frontiersin.org/articles/10.3389/fnagi.2020.00107/pdf,published: 12 May 2020,33.3,10.3389/fnagi.2020.00107,validated,DOI 10.3389/fnagi.2020.00107 found in PDF matches expected DOI 10.3389/fnagi.2020.00107
REFINE-0250,Effects of aerobic exercise training on brain structure and psychological well-being in young adults,,data/pdfs/REFINE-0250.pdf,publisher_403,none,http://www.thelancet.com/article/S0140673620303676/pdf,,0.0,,missing_pdf,PDF file not found on disk
REFINE-0251,Grey matter volume increase following electroconvulsive therapy in patients with late life depression: A longitudinal MRI study,10.1503/jpn.140322,data/pdfs/REFINE-0251.pdf,downloaded,openalex,https://pure.amsterdamumc.nl/ws/files/160666861/Grey-matter-volume-increase-following-electroconvulsive-therapy-in-patients-with-late-life-depression-a-longitudinal-mr.pdf,Grey matter volume increase following,100.0,10.1503/jpn.140322,validated,DOI 10.1503/jpn.140322 found in PDF matches expected DOI 10.1503/jpn.140322
REFINE-0252,The functional neuroanatomy of geriatric depression,10.1002/gps.2185,data/pdfs/REFINE-0252.pdf,publisher_403,none,https://doi.org/10.1002/gps.2185,,0.0,,missing_pdf,PDF file not found on disk
REFINE-0253,Neural mapping of anhedonia across psychiatric diagnoses: A transdiagnostic neuroimaging analysis,10.1016/j.nicl.2021.102825,data/pdfs/REFINE-0253.pdf,publisher_403,none,https://doaj.org/article/213844ef48d14fca912b95b2b6bf39a5,,0.0,,missing_pdf,PDF file not found on disk
REFINE-0254,Cell adhesion molecule expression in the dorsolateral prefrontal cortex and anterior cingulate cortex in major depression in the elderly,10.1017/s0007125000161847,data/pdfs/REFINE-0254.pdf,downloaded,openalex_landing_page,https://www.cambridge.org/core/services/aop-cambridge-core/content/view/F608763FC3A16CF4629ABD0A6AF31A35/S0007125000161847a.pdf/div-class-title-cell-adhesion-molecule-expression-in-the-dorsolateral-prefrontal-cortex-and-anterior-cingulate-cortex-in-major-depression-in-the-elderly-div.pdf,major depression.major depression.,100.0,10.1192/bjp.181.2.129,validated,Title similarity 100.0% >= 85% threshold
REFINE-0255,Delusional depression responding to clomipramine in Binswanger’s disease,10.1097/00005053-199007000-00009,data/pdfs/REFINE-0255.pdf,landing_page_unresolved,none,,,0.0,,missing_pdf,PDF file not found on disk
REFINE-0256,Altered brain regional homogeneity is associated with depressive symptoms in COVID-19,10.1016/j.jad.2022.06.061,data/pdfs/REFINE-0256.pdf,publisher_403,none,http://hdl.handle.net/11577/3458002,,0.0,,missing_pdf,PDF file not found on disk
REFINE-0257,Reduction of dorsolateral prefrontal cortex gray matter in late-life depression,10.1016/j.pscychresns.2011.01.003,data/pdfs/REFINE-0257.pdf,pmc_fulltext_no_pdf,none,,,0.0,,missing_pdf,PDF file not found on disk
REFINE-0258,Regional patterns of brain tissue loss associated with depression in Parkinson disease,10.1212/wnl.0b013e3181f11c1d,data/pdfs/REFINE-0258.pdf,publisher_403,none,https://doi.org/10.1212/wnl.0b013e3181f11c1d,,0.0,,missing_pdf,PDF file not found on disk
REFINE-0259,Six-week oral ketamine treatment for chronic suicidality is associated with increased grey matter volume,10.1016/j.pscychresns.2021.111369,data/pdfs/REFINE-0259.pdf,landing_page_unresolved,none,,,0.0,,missing_pdf,PDF file not found on disk
REFINE-0260,Serotonin selective reuptake inhibitor treatment improves cognition and grey matter atrophy but not amyloid burden during two-year follow-up in mild cognitive impairment and Alzheimer’s disease patients with depressive symptoms,10.3233/jad-170387,data/pdfs/REFINE-0260.pdf,publisher_403,none,https://doi.org/10.3233/jad-170387,,0.0,,missing_pdf,PDF file not found on disk
REFINE-0261,First episode drug-naïve major depressive disorder with panic disorder: Gray matter deficits in limbic and default network structures,10.1016/j.euroneuro.2010.06.002,data/pdfs/REFINE-0261.pdf,landing_page_unresolved,none,,,0.0,,missing_pdf,PDF file not found on disk
REFINE-0262,Alterations in CRY2 and PER3 gene expression associated with thalamic-limbic community structural abnormalities in patients with bipolar depression or unipolar depression,10.1016/j.jad.2021.10.125,data/pdfs/REFINE-0262.pdf,landing_page_unresolved,none,,,0.0,,missing_pdf,PDF file not found on disk
REFINE-0263,Alterations in cortical volume and complexity in Parkinson’s disease with depression,10.1111/cns.14582,data/pdfs/REFINE-0263.pdf,publisher_403,none,https://onlinelibrary.wiley.com/doi/pdfdirect/10.1111/cns.14582,,0.0,,missing_pdf,PDF file not found on disk
