paper_id,expected_title,doi,pdf_path,manifest_status,source_used,pdf_url,extracted_title_or_first_text,title_similarity,doi_found_in_pdf,audit_status,reason
REFINE-0264,Antidepressant effects of tDCS are associated with prefrontal gray matter volumes at baseline: Evidence from the ELECT-TDCS trial,10.1016/j.brs.2019.05.006,data/pdfs/REFINE-0264.pdf,publisher_403,none,https://doaj.org/article/a26ac928b572447985c410984e5be658,,0.0,,missing_pdf,PDF file not found on disk
REFINE-0265,Gray matter characteristics associated with trait anxiety in older adults are moderated by depression,10.1017/s1041610215000836,data/pdfs/REFINE-0265.pdf,repository_landing_page,none,,,0.0,,missing_pdf,PDF file not found on disk
REFINE-0266,A shared effect of paroxetine treatment on gray matter volume in depressive patients with and without childhood maltreatment: A voxel‐based morphometry study,10.1111/cns.13055,data/pdfs/REFINE-0266.pdf,publisher_403,none,https://onlinelibrary.wiley.com/doi/pdfdirect/10.1111/cns.13055,,0.0,,missing_pdf,PDF file not found on disk
REFINE-0267,Relationship of orthostatic blood pressure to white matter hyperintensities and subcortical volumes in late-life depression,10.1192/bjp.bp.110.090423,data/pdfs/REFINE-0267.pdf,downloaded,openalex,https://www.cambridge.org/core/services/aop-cambridge-core/content/view/078934F7756ECFDB5753D73123A33699/S0007125000078958a.pdf/div-class-title-relationship-of-orthostatic-blood-pressure-to-white-matter-hyperintensities-and-subcortical-volumes-in-late-life-depression-div.pdf,important role in late-life depression led to the ‘vascular,66.0,10.1192/bjp.bp.110.090423,validated,DOI 10.1192/bjp.bp.110.090423 found in PDF matches expected DOI 10.1192/bjp.bp.110.090423
REFINE-0268,Gray matter volume alterations associated with suicidal ideation and suicide attempts in patients with mood disorders,10.1186/s12991-020-00318-y,data/pdfs/REFINE-0268.pdf,downloaded,openalex,https://annals-general-psychiatry.biomedcentral.com/track/pdf/10.1186/s12991-020-00318-y,Gray matter volume alterations associated,100.0,10.1186/s12991-020-00318-y,validated,DOI 10.1186/s12991-020-00318-y found in PDF matches expected DOI 10.1186/s12991-020-00318-y
REFINE-0269,Loss of superiority illusion in bipolar depressive disorder: A combined functional and structural MRI study,10.1016/j.jpsychires.2022.04.034,data/pdfs/REFINE-0269.pdf,landing_page_unresolved,none,,,0.0,,missing_pdf,PDF file not found on disk
REFINE-0270,"Regional, circuit and network heterogeneity of brain abnormalities in psychiatric disorders",10.1038/s41593-023-01404-6,data/pdfs/REFINE-0270.pdf,downloaded,openalex,https://www.nature.com/articles/s41593-023-01404-6.pdf,Nature Neuroscience | Volume 26 | September 2023 | 1613–1629,33.3,10.1038/s41593-023-01404-6,validated,DOI 10.1038/s41593-023-01404-6 found in PDF matches expected DOI 10.1038/s41593-023-01404-6
REFINE-0271,"Cognitive behavioral therapy for antenatal depression in a pilot randomized controlled trial and effects on neurobiological, behavioral and cognitive outcomes in offspring 3–7 years postpartum: A perspective article on study findings, limitations and future aims",10.3389/fpsyt.2020.00034,data/pdfs/REFINE-0271.pdf,downloaded,openalex,https://www.frontiersin.org/articles/10.3389/fpsyt.2020.00034/pdf,Cognitive Behavioral Therapy for,100.0,10.3389/fpsyt.2020.00034,validated,DOI 10.3389/fpsyt.2020.00034 found in PDF matches expected DOI 10.3389/fpsyt.2020.00034
REFINE-0272,The gray matter alterations in major depressive disorder and panic disorder: Putative differences in the pathogenesis,10.1016/j.jad.2015.07.022,data/pdfs/REFINE-0272.pdf,landing_page_unresolved,none,,,0.0,,missing_pdf,PDF file not found on disk
REFINE-0273,"Migraine, depression, and brain volume: The AGES-Reykjavik Study",10.1212/wnl.0b013e318295d69e,data/pdfs/REFINE-0273.pdf,publisher_403,none,https://doi.org/10.1212/wnl.0b013e318295d69e,,0.0,,missing_pdf,PDF file not found on disk
REFINE-0274,Associations between subclinical depressive symptoms and reduced brain volume in middle-aged to older adults,10.1080/13607863.2018.1432030,data/pdfs/REFINE-0274.pdf,publisher_403,none,https://doi.org/10.1080/13607863.2018.1432030,,0.0,,missing_pdf,PDF file not found on disk
REFINE-0275,Significant age by childhood trauma interactions on grey matter volumes: A whole brain VBM analysis,10.1111/bdi.13286,data/pdfs/REFINE-0275.pdf,publisher_403,none,https://onlinelibrary.wiley.com/doi/pdfdirect/10.1111/bdi.13286,,0.0,,missing_pdf,PDF file not found on disk
REFINE-0276,Antidepressants upregulate c-Fos expression in the lateral entorhinal cortex and hippocampal dorsal subiculum: Study in rats,10.1016/j.brainresbull.2019.08.015,data/pdfs/REFINE-0276.pdf,landing_page_unresolved,none,,,0.0,,missing_pdf,PDF file not found on disk
REFINE-0277,Increased orbitofrontal cortex levels of choline in depressed adolescents as detected by in vivo proton magnetic resonance spectroscopy,10.1016/s0006-3223(00)00942-2,data/pdfs/REFINE-0277.pdf,landing_page_unresolved,none,,,0.0,,missing_pdf,PDF file not found on disk
REFINE-0278,"Myelin staining of deep white matter in the dorsolateral prefrontal cortex in schizophrenia, bipolar disorder, and unipolar major depression",10.1016/j.psychres.2006.12.019,data/pdfs/REFINE-0278.pdf,landing_page_unresolved,none,,,0.0,,missing_pdf,PDF file not found on disk
REFINE-0279,Index electroconvulsive therapy course to treat severe suicidality and depression in Fahr disease,10.1097/yct.0000000000000264,data/pdfs/REFINE-0279.pdf,landing_page_unresolved,none,,,0.0,,missing_pdf,PDF file not found on disk
REFINE-0280,Rumination mediates the relationship between structural variations in ventrolateral prefrontal cortex and sensitivity to negative life events,10.1016/j.neuroscience.2013.09.053,data/pdfs/REFINE-0280.pdf,landing_page_unresolved,none,,,0.0,,missing_pdf,PDF file not found on disk
REFINE-0281,"Longitudinal magnetic resonance imaging vascular changes, apolipoprotein E genotype, and development of dementia in the neurocognitive outcomes of depression in the elderly study",10.1097/jgp.0b013e318048a1a0,data/pdfs/REFINE-0281.pdf,landing_page_unresolved,none,,,0.0,,missing_pdf,PDF file not found on disk
REFINE-0282,Impact of early and recent stress on white matter microstructure in major depressive disorder,10.1016/j.jad.2017.08.017,data/pdfs/REFINE-0282.pdf,landing_page_unresolved,none,,,0.0,,missing_pdf,PDF file not found on disk
REFINE-0283,Frontal atrophy and attention deficits in older adults with a history of elevated depressive symptoms,10.1007/s11682-009-9078-z,data/pdfs/REFINE-0283.pdf,pmc_fulltext_no_pdf,none,,,0.0,,missing_pdf,PDF file not found on disk
REFINE-0284,Subcortical hyperintensities on magnetic resonance imaging: Clinical correlates and prognostic significance in patients with severe depression,10.1016/0006-3223(94)00174-2,data/pdfs/REFINE-0284.pdf,landing_page_unresolved,none,,,0.0,,missing_pdf,PDF file not found on disk
REFINE-0285,Right external globus pallidus changes are associated with altered causal awareness in youth with depression,10.1038/tp.2015.148,data/pdfs/REFINE-0285.pdf,downloaded,openalex,https://www.nature.com/articles/tp2015148.pdf,Right external globus pallidus changes are associated with,100.0,10.1038/tp.2015.148,validated,DOI 10.1038/tp.2015.148 found in PDF matches expected DOI 10.1038/tp.2015.148
REFINE-0286,"The temptation of suicide: striatal gray matter, discounting of delayed rewards, and suicide attempts in late-life depression",10.1017/s0033291711002133,data/pdfs/REFINE-0286.pdf,downloaded,openalex_landing_page,https://www.cambridge.org/core/services/aop-cambridge-core/content/view/423E1117E5BE3F3A7FF04FC03FF9B69D/S0033291711002133a.pdf/div-class-title-the-temptation-of-suicide-striatal-gray-matter-discounting-of-delayed-rewards-and-suicide-attempts-in-late-life-depression-div.pdf,"The temptation of suicide: striatal gray matter,",100.0,10.1017/S0033291711002133,validated,DOI 10.1017/S0033291711002133 found in PDF matches expected DOI 10.1017/s0033291711002133
REFINE-0287,Lifetime PTSD and geriatric depression symptomatology relate to altered dorsomedial frontal and amygdala morphometry,10.1016/j.pscychresns.2017.07.003,data/pdfs/REFINE-0287.pdf,publisher_403,none,https://www.sciencedirect.com/science/article/am/pii/S0925492716303353?via%3Dihub,,0.0,,missing_pdf,PDF file not found on disk
REFINE-0288,Divergent anatomical correlates and functional network connectivity patterns in temporal lobe epilepsy with and without depression,10.1007/s10548-021-00848-y,data/pdfs/REFINE-0288.pdf,landing_page_unresolved,none,,,0.0,,missing_pdf,PDF file not found on disk
REFINE-0289,The orbitofrontal cortex gray matter is associated with the interaction between insomnia and depression,10.3389/fpsyt.2018.00651,data/pdfs/REFINE-0289.pdf,downloaded,openalex,https://www.frontiersin.org/articles/10.3389/fpsyt.2018.00651/pdf,Frontiers in Psychiatry | www.frontiersin.org 1 December 2018 | Volume 9 | Article 651,41.3,10.3389/fpsyt.2018.00651,validated,DOI 10.3389/fpsyt.2018.00651 found in PDF matches expected DOI 10.3389/fpsyt.2018.00651
REFINE-0290,Neural basis underlying the association between thought control ability and happiness: The moderating role of the amygdala,10.1002/pchj.741,data/pdfs/REFINE-0290.pdf,publisher_403,none,https://onlinelibrary.wiley.com/doi/pdfdirect/10.1002/pchj.741,,0.0,,missing_pdf,PDF file not found on disk
REFINE-0291,Transdiagnostic subgroups of cognitive impairment in early affective and psychotic illness,10.1038/s41386-023-01729-7,data/pdfs/REFINE-0291.pdf,downloaded,openalex,https://www.nature.com/articles/s41386-023-01729-7.pdf,Transdiagnostic subgroups of cognitive impairment in early,100.0,10.1038/s41386-023-01729-7,validated,DOI 10.1038/s41386-023-01729-7 found in PDF matches expected DOI 10.1038/s41386-023-01729-7
REFINE-0292,Basal ganglia morphology links the metabolic syndrome and depressive symptoms,10.1016/j.physbeh.2013.09.014,data/pdfs/REFINE-0292.pdf,pmc_pdf_not_found,none,,,0.0,,missing_pdf,PDF file not found on disk
REFINE-0293,Exposure to parental verbal abuse is associated with increased gray matter volume in superior temporal gyrus,10.1016/j.neuroimage.2010.05.027,data/pdfs/REFINE-0293.pdf,downloaded,openalex_landing_page,https://kumadai.repo.nii.ac.jp/record/23763/files/Tomoda_VA_Neuroimage_2010r.pdf,Exposure to Parental Verbal Abuse is Associated with,100.0,,validated,Title similarity 100.0% >= 85% threshold
REFINE-0294,Altered cerebral blood flow in Alzheimer’s disease with depression,10.3389/fpsyt.2021.687739,data/pdfs/REFINE-0294.pdf,downloaded,openalex,https://www.frontiersin.org/articles/10.3389/fpsyt.2021.687739/pdf,Frontiers in Psychiatry | www.frontiersin.org 1 July 2021 | Volume 12 | Article 687739,36.2,10.3389/fpsyt.2021.687739,validated,DOI 10.3389/fpsyt.2021.687739 found in PDF matches expected DOI 10.3389/fpsyt.2021.687739
REFINE-0295,Biological and social predictors of long-term geriatric depression outcome,10.1017/s1041610205000979,data/pdfs/REFINE-0295.pdf,landing_page_unresolved,none,,,0.0,,missing_pdf,PDF file not found on disk
REFINE-0296,Neuroanatomical characteristics of geriatric apathy and depression: A magnetic resonance imaging study,10.1097/jgp.0b013e3180325a16,data/pdfs/REFINE-0296.pdf,pmc_fulltext_no_pdf,none,,,0.0,,missing_pdf,PDF file not found on disk
REFINE-0297,Depression in dementia with Lewy bodies: A critical update,10.1007/s00702-023-02669-8,data/pdfs/REFINE-0297.pdf,landing_page_unresolved,none,,,0.0,,missing_pdf,PDF file not found on disk
REFINE-0298,Neuroanatomy in monozygotic twins with Asperger disorder discordant for comorbid depression,10.1212/01.wnl.0000172360.99310.3f,data/pdfs/REFINE-0298.pdf,publisher_403,none,https://doi.org/10.1212/01.wnl.0000172360.99310.3f,,0.0,,missing_pdf,PDF file not found on disk
REFINE-0299,Mapping Brain Size and Cortical Gray Matter Changes in Elderly Depression,10.1016/j.biopsych.2003.09.004,data/pdfs/REFINE-0299.pdf,landing_page_unresolved,none,,,0.0,,missing_pdf,PDF file not found on disk
REFINE-0300,Cortical alterations are associated with depression in subcortical vascular mild cognitive impairment revealed by surface-based morphometry,,data/pdfs/REFINE-0300.pdf,publisher_403,none,https://doi.org/10.1152/physrev.00034.2015,,0.0,,missing_pdf,PDF file not found on disk
REFINE-0301,Structural brain changes as biomarkers and outcome predictors in patients with late-life depression: A cross-sectional and prospective study,10.1371/journal.pone.0080049,data/pdfs/REFINE-0301.pdf,downloaded,openalex,https://journals.plos.org/plosone/article/file?id=10.1371/journal.pone.0080049&type=printable,Structural Brain Changes as Biomarkers and Outcome,100.0,10.1371/journal.pone.0080049,validated,DOI 10.1371/journal.pone.0080049 found in PDF matches expected DOI 10.1371/journal.pone.0080049
REFINE-0302,Alterations of brain volumes in women with early life maltreatment and their associations with oxytocin,10.1016/j.yhbeh.2017.11.005,data/pdfs/REFINE-0302.pdf,landing_page_unresolved,none,,,0.0,,missing_pdf,PDF file not found on disk
REFINE-0303,"Altruistic Social Activity, Depressive Symptoms, and Brain Regional Gray Matter Volume: Voxel-Based Morphometry Analysis From 8,695 Old Adults",10.1093/gerona/glac093,data/pdfs/REFINE-0303.pdf,publisher_403,none,https://doi.org/10.1093/gerona/glac093,,0.0,,missing_pdf,PDF file not found on disk
REFINE-0304,Atrophy of right inferior frontal orbital gyrus and frontoparietal functional connectivity abnormality in depressed suicide attempters,10.1007/s11682-019-00206-4,data/pdfs/REFINE-0304.pdf,landing_page_unresolved,none,,,0.0,,missing_pdf,PDF file not found on disk
REFINE-0305,Anterior cingulate cortical volumes and treatment remission of geriatric depression,10.1002/gps.2290,data/pdfs/REFINE-0305.pdf,publisher_403,none,https://onlinelibrary.wiley.com/doi/pdfdirect/10.1002/gps.2290,,0.0,,missing_pdf,PDF file not found on disk
REFINE-0306,Negative emotions and brain: Negative emotions mediates the association between structural and functional variations in emotional-related brain regions and sleep quality,10.1016/j.sleep.2022.03.023,data/pdfs/REFINE-0306.pdf,landing_page_unresolved,none,,,0.0,,missing_pdf,PDF file not found on disk
REFINE-0307,"A longitudinal, randomized experimental pilot study to investigate the effects of airborne infrasound on human mental health, cognition, and brain structure",10.1038/s41598-021-82203-6,data/pdfs/REFINE-0307.pdf,downloaded,openalex,https://www.nature.com/articles/s41598-021-82203-6.pdf,"A longitudinal, randomized",100.0,10.1038/s41598-021-82203-6,validated,DOI 10.1038/s41598-021-82203-6 found in PDF matches expected DOI 10.1038/s41598-021-82203-6
REFINE-0308,State-dependent and trait-related gray matter changes in nonrefractory depression,10.1097/wnr.0000000000000301,data/pdfs/REFINE-0308.pdf,landing_page_unresolved,none,,,0.0,,missing_pdf,PDF file not found on disk
REFINE-0309,Naltrexone treatment reverses astrocyte atrophy and immune dysfunction in self-harming macaques,10.1016/j.bbi.2015.07.017,data/pdfs/REFINE-0309.pdf,pmc_fulltext_no_pdf,none,,,0.0,,missing_pdf,PDF file not found on disk
REFINE-0310,Tissue-specific differences in brain phosphodiesters in late-life major depression,10.1016/j.jagp.2012.08.005,data/pdfs/REFINE-0310.pdf,pmc_fulltext_no_pdf,none,,,0.0,,missing_pdf,PDF file not found on disk
REFINE-0311,Optic coherence tomography shows inflammation and degeneration in major depressive disorder patients correlated with disease severity,10.1016/j.jad.2016.06.039,data/pdfs/REFINE-0311.pdf,landing_page_unresolved,none,,,0.0,,missing_pdf,PDF file not found on disk
REFINE-0312,Structural brain alterations in older adults exposed to early-life adversity,10.1016/j.psyneuen.2021.105272,data/pdfs/REFINE-0312.pdf,publisher_403,none,https://www.sciencedirect.com/science/article/am/pii/S0306453021001463?via%3Dihub,,0.0,,missing_pdf,PDF file not found on disk
REFINE-0313,The serotonin transporter genotype modulates the relationship between early stress and adult suicidality in bipolar disorder,10.1111/bdi.12250,data/pdfs/REFINE-0313.pdf,publisher_403,none,https://doi.org/10.1111/bdi.12250,,0.0,,missing_pdf,PDF file not found on disk
REFINE-0314,Imaging the neuroplastic effects of ketamine with VBM and the necessity of placebo control,10.1016/j.neuroimage.2016.12.032,data/pdfs/REFINE-0314.pdf,landing_page_unresolved,none,,,0.0,,missing_pdf,PDF file not found on disk
REFINE-0315,Early and late effects of electroconvulsive therapy associated with different temporal lobe structures,10.1038/s41398-020-01025-8,data/pdfs/REFINE-0315.pdf,downloaded,openalex,https://www.nature.com/articles/s41398-020-01025-8.pdf,Early and late effects of electroconvulsive therapy,100.0,10.1038/s41398-020-01025-8,validated,DOI 10.1038/s41398-020-01025-8 found in PDF matches expected DOI 10.1038/s41398-020-01025-8
REFINE-0316,Variant in oxytocin receptor gene is associated with amygdala volume,10.1016/j.psyneuen.2010.12.004,data/pdfs/REFINE-0316.pdf,pmc_fulltext_no_pdf,none,,,0.0,,missing_pdf,PDF file not found on disk
REFINE-0317,"Cumulative adversity and smaller gray matter volume in medial prefrontal, anterior cingulate, and insula regions",10.1016/j.biopsych.2011.11.022,data/pdfs/REFINE-0317.pdf,pmc_pdf_not_found,none,,,0.0,,missing_pdf,PDF file not found on disk
REFINE-0318,"Association of cerebral amyloidosis, blood pressure, and neuronal injury with late-life onset depression",,data/pdfs/REFINE-0318.pdf,publisher_403,none,https://doaj.org/article/840bb506acaf4974bcf1db66dfaf1c8f,,0.0,,missing_pdf,PDF file not found on disk
REFINE-0319,Associations between parental depression and anxiety symptom severity and their offspring’s cortical thickness and subcortical volume,10.1016/j.jpsychires.2023.09.014,data/pdfs/REFINE-0319.pdf,landing_page_unresolved,none,,,0.0,,missing_pdf,PDF file not found on disk
REFINE-0320,"Linking menopause-related factors, history of depression, APOE ε4, and proxies of biological aging in the UK biobank cohort",10.1016/j.yhbeh.2024.105596,data/pdfs/REFINE-0320.pdf,downloaded,openalex,https://iris.unil.ch/bitstreams/075797f7-b486-4c9a-991b-a5b602d6ac03/download,"Linking menopause-related factors, history of depression, APOE ε 4 , and",99.3,10.1016/j.yhbeh.2024.105596,validated,DOI 10.1016/j.yhbeh.2024.105596 found in PDF matches expected DOI 10.1016/j.yhbeh.2024.105596
REFINE-0321,Regional brain volume in depression and anxiety disorders,10.1001/archgenpsychiatry.2010.121,data/pdfs/REFINE-0321.pdf,publisher_403,none,https://doi.org/10.1001/archgenpsychiatry.2010.121,,0.0,,missing_pdf,PDF file not found on disk
REFINE-0322,Cortical volume reductions in men transitioning to first-time fatherhood reflect both parenting engagement and mental health risk,10.1093/cercor/bhae126,data/pdfs/REFINE-0322.pdf,publisher_403,none,https://academic.oup.com/cercor/article-pdf/34/4/bhae126/57229670/bhae126.pdf,,0.0,,missing_pdf,PDF file not found on disk
REFINE-0323,Depression is associated with preserved cortical thickness relative to apathy in frontotemporal dementia,10.1177/0891988720964258,data/pdfs/REFINE-0323.pdf,publisher_403,none,https://doi.org/10.1177/0891988720964258,,0.0,,missing_pdf,PDF file not found on disk
REFINE-0324,Apolipoprotein E genotype and subcortical vascular lesions in older depressed patients and control subjects,10.1016/s0006-3223(02)01782-1,data/pdfs/REFINE-0324.pdf,landing_page_unresolved,none,,,0.0,,missing_pdf,PDF file not found on disk
REFINE-0325,Brain-Cognition Associations in Older Patients With Remitted Major Depressive Disorder or Mild Cognitive Impairment: A Multivariate Analysis of Gray and White Matter Integrity,10.1016/j.biopsych.2023.05.018,data/pdfs/REFINE-0325.pdf,landing_page_unresolved,none,,,0.0,,missing_pdf,PDF file not found on disk
REFINE-0326,Improved anatomic delineation of the antidepressant response to partial sleep deprivation in medial frontal cortex using perfusion-weighted functional MRI,10.1016/j.pscychresns.2005.12.008,data/pdfs/REFINE-0326.pdf,pmc_fulltext_no_pdf,none,,,0.0,,missing_pdf,PDF file not found on disk
REFINE-0327,Neural correlates of adolescent irritability and its comorbidity with psychiatric disorders,10.1016/j.jaac.2019.11.028,data/pdfs/REFINE-0327.pdf,landing_page_unresolved,none,,,0.0,,missing_pdf,PDF file not found on disk
REFINE-0328,Neuroimaging changes in mesial temporal lobe epilepsy are magnified in the presence of depression,10.1016/j.yebeh.2010.08.012,data/pdfs/REFINE-0328.pdf,publisher_403,none,http://www.epilepsybehavior.com/article/S1525505010005469/pdf,,0.0,,missing_pdf,PDF file not found on disk
REFINE-0329,Neuroanatomical correlates of depression in Friedreich’s ataxia: A voxel-based morphometry study,10.1007/s12311-012-0424-0,data/pdfs/REFINE-0329.pdf,landing_page_unresolved,none,,,0.0,,missing_pdf,PDF file not found on disk
REFINE-0330,Cognitive impairment and structural abnormalities in late life depression with olfactory identification impairment: An Alzheimer’s disease-like pattern,10.1093/ijnp/pyy016,data/pdfs/REFINE-0330.pdf,publisher_403,none,https://academic.oup.com/ijnp/article-pdf/21/7/640/25112994/pyy016.pdf,,0.0,,missing_pdf,PDF file not found on disk
REFINE-0331,The association of psychosocial risk factors for mental health with a brain marker altered by inflammation: A translocator protein (TSPO) PET imaging study,10.1016/j.bbi.2019.05.023,data/pdfs/REFINE-0331.pdf,landing_page_unresolved,none,,,0.0,,missing_pdf,PDF file not found on disk
REFINE-0332,Enhanced temporal coupling between thalamus and dorsolateral prefrontal cortex mediates chronic low back pain and depression,10.1155/2021/7498714,data/pdfs/REFINE-0332.pdf,publisher_403,none,https://downloads.hindawi.com/journals/np/2021/7498714.pdf,,0.0,,missing_pdf,PDF file not found on disk
REFINE-0333,Structural abnormalities associated with poor outcome of a major depressive episode: The role of thalamus,10.1016/j.pscychresns.2020.111158,data/pdfs/REFINE-0333.pdf,downloaded,openalex_landing_page,https://hal.science/hal-02920551v1/file/JMBatail_Psychresni_accepted%20version.pdf,for the deposit and dissemination of scientific re-,46.4,10.1016/j.pscychresns.2020.111158⟩.,validated,DOI 10.1016/j.pscychresns.2020.111158⟩. found in PDF matches expected DOI 10.1016/j.pscychresns.2020.111158
REFINE-0334,Greater MRI lesion volumes in elderly depressed subjects than in control subjects,10.1016/j.pscychresns.2004.08.004,data/pdfs/REFINE-0334.pdf,landing_page_unresolved,none,,,0.0,,missing_pdf,PDF file not found on disk
REFINE-0335,Prefrontal resting-state connectivity and antidepressant response: No associations in the ELECT‑TDCS trial,10.1007/s00406-020-01187-y,data/pdfs/REFINE-0335.pdf,landing_page_unresolved,none,,,0.0,,missing_pdf,PDF file not found on disk
REFINE-0336,Maternal Childhood Maltreatment Is Associated With Lower Infant Gray Matter Volume and Amygdala Volume During the First Two Years of Life,10.1016/j.bpsgos.2021.09.005,data/pdfs/REFINE-0336.pdf,pmc_fulltext_no_pdf,none,,,0.0,,missing_pdf,PDF file not found on disk
REFINE-0337,Baseline clinical and neuroimaging biomarkers of treatment response to high-frequency rTMS over the left DLPFC for resistant depression,10.3389/fpsyt.2022.894473,data/pdfs/REFINE-0337.pdf,downloaded,openalex,https://www.frontiersin.org/articles/10.3389/fpsyt.2022.894473/pdf,Frontiers in Psychiatry | www.frontiersin.org 1 May 2022 | Volume 13 | Article 894473,38.0,10.3389/fpsyt.2022.894473,validated,DOI 10.3389/fpsyt.2022.894473 found in PDF matches expected DOI 10.3389/fpsyt.2022.894473
REFINE-0338,White matter hyperintensity accumulation during treatment of late-life depression,10.1038/npp.2015.158,data/pdfs/REFINE-0338.pdf,invalid_pdf,none,,,0.0,,missing_pdf,PDF file not found on disk
REFINE-0339,Examining gray matter structures associated with individual differences in global life satisfaction in a large sample of young adults,10.1093/scan/nsu144,data/pdfs/REFINE-0339.pdf,publisher_403,none,https://academic.oup.com/scan/article-pdf/10/7/952/27101470/nsu144.pdf,,0.0,,missing_pdf,PDF file not found on disk
REFINE-0340,Tubulin Polymerization Promoting Protein (TPPP) gene methylation and corpus callosum measures in maltreated children,10.1016/j.pscychresns.2020.111058,data/pdfs/REFINE-0340.pdf,pmc_fulltext_no_pdf,none,,,0.0,,missing_pdf,PDF file not found on disk
REFINE-0341,Hippocampal volume and depression among young children,10.1016/j.pscychresns.2019.04.012,data/pdfs/REFINE-0341.pdf,pmc_fulltext_no_pdf,none,,,0.0,,missing_pdf,PDF file not found on disk
REFINE-0342,Magnetic resonance imaging in late-life depression: Vascular and glucocorticoid cascade hypotheses,10.1192/bjp.bp.111.105361,data/pdfs/REFINE-0342.pdf,downloaded,openalex,https://www.cambridge.org/core/services/aop-cambridge-core/content/view/94DC49AB912C46C2BE319634E1E5F660/S0007125000271614a.pdf/div-class-title-magnetic-resonance-imaging-in-late-life-depression-vascular-and-glucocorticoid-cascade-hypotheses-div.pdf,Late-life depression is a multifactorial illness that is associated,56.7,10.1192/bjp.bp.111.105361,validated,DOI 10.1192/bjp.bp.111.105361 found in PDF matches expected DOI 10.1192/bjp.bp.111.105361
REFINE-0343,Transcranial magnetic stimulation of left dorsolateral prefrontal cortex induces brain morphological changes in regions associated with a treatment resistant major depressive episode: An exploratory analysis,10.1016/j.brs.2016.02.011,data/pdfs/REFINE-0343.pdf,publisher_403,none,https://doaj.org/article/3521a0d382af4e6ca88b244860d2e5a5,,0.0,,missing_pdf,PDF file not found on disk
