paper_id,expected_title,doi,pdf_path,manifest_status,source_used,pdf_url,extracted_title_or_first_text,title_similarity,doi_found_in_pdf,audit_status,reason
REFINE-0105,Smaller gray matter volume of hippocampus/parahippocampus in elderly people with subthreshold depression: A cross-sectional study,10.1186/s12888-016-0928-0,data/pdfs/REFINE-0105.pdf,downloaded,openalex_landing_page,https://link.springer.com/content/pdf/10.1186/s12888-016-0928-0.pdf,Smaller gray matter volume of,100.0,10.1186/s12888-016-0928-0,validated,DOI 10.1186/s12888-016-0928-0 found in PDF matches expected DOI 10.1186/s12888-016-0928-0
REFINE-0106,Effect of childhood physical abuse on social anxiety is mediated via reduced frontal lobe and amygdala-hippocampus complex volume in adult clinical high-risk subjects,10.1016/j.schres.2020.05.041,data/pdfs/REFINE-0106.pdf,repository_landing_page,none,,,0.0,,missing_pdf,PDF file not found on disk
REFINE-0107,Combined treatment with escitalopram and memantine increases gray matter volume and cortical thickness compared to escitalopram and placebo in a pilot study of geriatric depression,10.1016/j.jad.2020.05.092,data/pdfs/REFINE-0107.pdf,publisher_403,none,https://escholarship.org/uc/item/8x26r86j,,0.0,,missing_pdf,PDF file not found on disk
REFINE-0108,Somatostatin receptor subtype 4 activation is involved in anxiety and depression-like behavior in mouse models,10.1016/j.neuropharm.2015.09.021,data/pdfs/REFINE-0108.pdf,landing_page_unresolved,none,,,0.0,,missing_pdf,PDF file not found on disk
REFINE-0109,No consistent difference in gray matter volume between individuals with fibromyalgia and age-matched healthy subjects when controlling for affective disorder,10.1016/j.pain.2009.03.017,data/pdfs/REFINE-0109.pdf,pmc_fulltext_no_pdf,none,,,0.0,,missing_pdf,PDF file not found on disk
REFINE-0110,Subcortical white matter lesions and functional impairment in geriatric depression,10.1002/da.1081,data/pdfs/REFINE-0110.pdf,publisher_403,none,https://onlinelibrary.wiley.com/doi/pdfdirect/10.1002/da.1081,,0.0,,missing_pdf,PDF file not found on disk
REFINE-0111,Association of electroconvulsive therapy-induced structural plasticity with clinical remission,10.1016/j.pnpbp.2021.110286,data/pdfs/REFINE-0111.pdf,publisher_403,none,https://www.sciencedirect.com/science/article/am/pii/S0278584621000452,,0.0,,missing_pdf,PDF file not found on disk
REFINE-0112,Gray matter regions statistically mediating the cross‐sectional association of eotaxin and set‐shifting among older adults with major depressive disorder,10.1002/gps.4585,data/pdfs/REFINE-0112.pdf,publisher_403,none,https://doi.org/10.1002/gps.4585,,0.0,,missing_pdf,PDF file not found on disk
REFINE-0113,Decreased hippocampal volume in healthy girls at risk of depression,10.1001/archgenpsychiatry.2009.202,data/pdfs/REFINE-0113.pdf,publisher_403,none,https://doi.org/10.1001/archgenpsychiatry.2009.202,,0.0,,missing_pdf,PDF file not found on disk
REFINE-0114,Increased Brain Gray Matter in the Primary Somatosensory Cortex is Associated with Increased Pain and Mood Disturbance in Patients with Interstitial Cystitis/Painful Bladder Syndrome,10.1016/j.juro.2014.08.042,data/pdfs/REFINE-0114.pdf,publisher_403,none,https://doi.org/10.1016/j.juro.2014.08.042,,0.0,,missing_pdf,PDF file not found on disk
REFINE-0115,Maternal depression during pregnancy alters infant subcortical and midbrain volumes,10.1016/j.jad.2021.05.008,data/pdfs/REFINE-0115.pdf,landing_page_unresolved,none,,,0.0,,missing_pdf,PDF file not found on disk
REFINE-0116,Metabolic compensation and depression in Alzheimer’s disease,10.1159/000257761,data/pdfs/REFINE-0116.pdf,publisher_403,none,https://doi.org/10.1159/000257761,,0.0,,missing_pdf,PDF file not found on disk
REFINE-0117,Vertex-wise examination of depressive symptom dimensions and brain volumes in older adults,10.1016/j.pscychresns.2016.12.008,data/pdfs/REFINE-0117.pdf,publisher_403,none,https://www.sciencedirect.com/science/article/am/pii/S0925492716300798,,0.0,,missing_pdf,PDF file not found on disk
REFINE-0118,Cortical thinning in preschoolers with maladaptive guilt,10.1016/j.pscychresns.2020.111195,data/pdfs/REFINE-0118.pdf,pmc_pdf_not_found,none,,,0.0,,missing_pdf,PDF file not found on disk
REFINE-0119,Evaluating the effect of birth weight on brain volumes and depression: An observational and genetic study using UK Biobank cohort,10.1192/j.eurpsy.2020.74,data/pdfs/REFINE-0119.pdf,downloaded,openalex,https://www.cambridge.org/core/services/aop-cambridge-core/content/view/B20B290633B7652A42DD8E222B605F3C/S0924933820000747a.pdf/div-class-title-evaluating-the-effect-of-birth-weight-on-brain-volumes-and-depression-an-observational-and-genetic-study-using-uk-biobank-cohort-div.pdf,Evaluating the effect of birth weight on brain,100.0,10.1192/j.eurpsy.2020.74,validated,DOI 10.1192/j.eurpsy.2020.74 found in PDF matches expected DOI 10.1192/j.eurpsy.2020.74
REFINE-0120,Influence of the MTHFR C677T polymorphism on magnetic resonance imaging hyperintensity volume and cognition in geriatric depression,10.1097/jgp.0b013e3181aad5b2,data/pdfs/REFINE-0120.pdf,pmc_fulltext_no_pdf,none,,,0.0,,missing_pdf,PDF file not found on disk
REFINE-0121,Identification of specific neural circuit underlying the key cognitive deficit of remitted late-onset depression: A multi-modal MRI and machine learning study,10.1016/j.pnpbp.2020.110192,data/pdfs/REFINE-0121.pdf,landing_page_unresolved,none,,,0.0,,missing_pdf,PDF file not found on disk
REFINE-0122,Regional gray matter abnormalities in pre-adolescent binge eating disorder: A voxel-based morphometry study,10.1016/j.psychres.2022.114473,data/pdfs/REFINE-0122.pdf,publisher_403,none,http://manuscript.elsevier.com/S0165178122000877/pdf/S0165178122000877.pdf,,0.0,,missing_pdf,PDF file not found on disk
REFINE-0123,Combined analysis of grey matter voxel-based morphometry and white matter tract-based spatial statistics in late-life bipolar disorder,10.1503/jpn.100140,data/pdfs/REFINE-0123.pdf,downloaded,openalex,https://iris.unil.ch/bitstreams/a3ce53a7-424d-441c-913e-79a978cd4426/download,statistics in late-life bipolar disorder,100.0,,validated,Title similarity 100.0% >= 85% threshold
REFINE-0124,Preliminary results from a pilot study examining brain structure in older adult cannabis users and nonusers,10.1016/j.pscychresns.2019.02.001,data/pdfs/REFINE-0124.pdf,invalid_pdf,none,,,0.0,,missing_pdf,PDF file not found on disk
REFINE-0125,Gray matter volume of rostral anterior cingulate cortex predicts rapid antidepressant response to ketamine,10.1016/j.euroneuro.2020.11.017,data/pdfs/REFINE-0125.pdf,landing_page_unresolved,none,,,0.0,,missing_pdf,PDF file not found on disk
REFINE-0126,Structural brain differences predict early traumatic memory processing,10.1111/psyp.13354,data/pdfs/REFINE-0126.pdf,publisher_403,none,https://doi.org/10.1111/psyp.13354,,0.0,,missing_pdf,PDF file not found on disk
REFINE-0127,The neuroanatomy of subthreshold depressive symptoms in Huntington’s disease: A combined diffusion tensor imaging (DTI) and voxel-based morphometry (VBM) study,10.1017/s003329171300247x,data/pdfs/REFINE-0127.pdf,downloaded,openalex_landing_page,https://www.cambridge.org/core/services/aop-cambridge-core/content/view/441013A631AC7FF8F943ABC3F1A670E6/S003329171300247Xa.pdf/div-class-title-the-neuroanatomy-of-subthreshold-depressive-symptoms-in-huntington-s-disease-a-combined-diffusion-tensor-imaging-dti-and-voxel-based-morphometry-vbm-study-div.pdf,The neuroanatomy of subthreshold depressive,100.0,10.1017/S003329171300247X,validated,DOI 10.1017/S003329171300247X found in PDF matches expected DOI 10.1017/s003329171300247x
REFINE-0128,Gray matter anomalies in anterior cingulate cortex as a correlate of depressive symptoms in drug-naïve idiopathic restless legs syndrome,10.1016/j.neuroscience.2014.06.045,data/pdfs/REFINE-0128.pdf,landing_page_unresolved,none,,,0.0,,missing_pdf,PDF file not found on disk
REFINE-0129,"Epidemiology of MRI-defined vascular depression: A longitudinal, community-based study in Korean elders",10.1016/j.jad.2015.04.008,data/pdfs/REFINE-0129.pdf,landing_page_unresolved,none,,,0.0,,missing_pdf,PDF file not found on disk
REFINE-0130,Subjectivity of the anomalous sense of self is represented in gray matter volume in the brain,10.3389/fnhum.2017.00232,data/pdfs/REFINE-0130.pdf,downloaded,openalex,https://www.frontiersin.org/articles/10.3389/fnhum.2017.00232/pdf,Subjectivity of the Anomalous Sense,100.0,10.3389/fnhum.2017.00232,validated,DOI 10.3389/fnhum.2017.00232 found in PDF matches expected DOI 10.3389/fnhum.2017.00232
REFINE-0131,Cross-sectional and longitudinal relationships between depressive symptoms and brain atrophy in MS patients,10.3389/fnhum.2016.00622,data/pdfs/REFINE-0131.pdf,downloaded,openalex,https://www.frontiersin.org/articles/10.3389/fnhum.2016.00622/pdf,Cross-Sectional and Longitudinal,100.0,10.3389/fnhum.2016.00622,validated,DOI 10.3389/fnhum.2016.00622 found in PDF matches expected DOI 10.3389/fnhum.2016.00622
REFINE-0132,Reduced cerebral blood flow within the default-mode network and within total gray matter in major depression,10.1089/brain.2012.0101,data/pdfs/REFINE-0132.pdf,publisher_403,none,https://doi.org/10.1089/brain.2012.0101,,0.0,,missing_pdf,PDF file not found on disk
REFINE-0133,Influence of the topography of brain damage on depression and fatigue in patients with multiple sclerosis,10.1177/1352458513493684,data/pdfs/REFINE-0133.pdf,publisher_403,none,https://doi.org/10.1177/1352458513493684,,0.0,,missing_pdf,PDF file not found on disk
REFINE-0134,Neural correlates of the association between depression and high density lipoprotein cholesterol change,10.1016/j.jpsychires.2020.07.012,data/pdfs/REFINE-0134.pdf,landing_page_unresolved,none,,,0.0,,missing_pdf,PDF file not found on disk
REFINE-0135,Perfectionism mediated the relationship between brain structure variation and negative emotion in a nonclinical sample,10.3758/s13415-016-0474-8,data/pdfs/REFINE-0135.pdf,downloaded,openalex,https://link.springer.com/content/pdf/10.3758/s13415-016-0474-8.pdf,Perfectionism mediated the relationship between brain structure,100.0,10.3758/s13415-016-0474-8,validated,DOI 10.3758/s13415-016-0474-8 found in PDF matches expected DOI 10.3758/s13415-016-0474-8
REFINE-0136,The neural substrates responsible for how trait anxiety affects delay discounting: Right hippocampal and cerebellar connectivity with bistable right inferior parietal lobule,10.1111/psyp.13495,data/pdfs/REFINE-0136.pdf,publisher_403,none,https://doi.org/10.1111/psyp.13495,,0.0,,missing_pdf,PDF file not found on disk
REFINE-0137,Maternal prenatal lead levels and neonatal brain volumes: Testing moderations by maternal depressive symptoms and family income,10.1016/j.ntt.2024.107322,data/pdfs/REFINE-0137.pdf,publisher_403,none,https://www.sciencedirect.com/science/article/am/pii/S0892036224000047,,0.0,,missing_pdf,PDF file not found on disk
REFINE-0138,Neuro-transcriptomic signatures for mood disorder morbidity and suicide mortality,10.1016/j.jpsychires.2020.05.013,data/pdfs/REFINE-0138.pdf,downloaded,semantic_scholar,https://www.biorxiv.org/content/biorxiv/early/2020/01/27/762492.full.pdf,Neuro-transcriptomic signatures for mood disorder morbidity and suicide mortality,100.0,10.1101/762492doi:,validated,Title similarity 100.0% >= 85% threshold
REFINE-0139,Structural and functional differences in the cingulate cortex relate to disease severity in anorexia nervosa,,data/pdfs/REFINE-0139.pdf,publisher_403,none,https://doaj.org/article/79d73bd530974f10ad5c4112dd8c19f1,,0.0,,missing_pdf,PDF file not found on disk
REFINE-0140,In vivo relationship between serotonin 1A receptor binding and gray matter volume in the healthy brain and in major depressive disorder,10.1007/s00429-018-1649-6,data/pdfs/REFINE-0140.pdf,pmc_fulltext_no_pdf,none,,,0.0,,missing_pdf,PDF file not found on disk
REFINE-0141,Biochemical abnormalities of the medial temporal lobe and medial prefrontal cortex in late-life depression,10.1016/j.pscychresns.2008.07.001,data/pdfs/REFINE-0141.pdf,invalid_pdf_title_mismatch,none,,,0.0,,missing_pdf,PDF file not found on disk
REFINE-0142,Brain structural correlates of depressive symptoms in Parkinson’s disease patients at different disease stage,10.1016/j.pscychresns.2019.111029,data/pdfs/REFINE-0142.pdf,landing_page_unresolved,none,,,0.0,,missing_pdf,PDF file not found on disk
REFINE-0143,Structural correlates of apathy in Alzheimer’s disease: a multimodal MRI study,10.1002/gps.4548,data/pdfs/REFINE-0143.pdf,publisher_403,none,https://doi.org/10.1002/gps.4548,,0.0,,missing_pdf,PDF file not found on disk
REFINE-0144,Short-term group cognitive behavior therapy contributes to recovery from mild depression: Evidence from functional and structural MRI,10.1016/j.pscychresns.2016.04.010,data/pdfs/REFINE-0144.pdf,landing_page_unresolved,none,,,0.0,,missing_pdf,PDF file not found on disk
REFINE-0145,Subcortical lesion severity and orbitofrontal cortex volume in geriatric depression,10.1016/s0006-3223(03)00063-5,data/pdfs/REFINE-0145.pdf,landing_page_unresolved,none,,,0.0,,missing_pdf,PDF file not found on disk
REFINE-0146,Imaging correlates of apathy and depression in Parkinson’s disease,10.1016/j.jns.2011.07.006,data/pdfs/REFINE-0146.pdf,landing_page_unresolved,none,,,0.0,,missing_pdf,PDF file not found on disk
REFINE-0147,Social cognition and frontal lobe pathology in schizophrenia: A voxel-based morphometric study,10.1016/j.neuroimage.2006.10.046,data/pdfs/REFINE-0147.pdf,landing_page_unresolved,none,,,0.0,,missing_pdf,PDF file not found on disk
REFINE-0148,Altered gray matter volumes in post-stroke depressive patients after subcortical stroke,10.1016/j.nicl.2020.102224,data/pdfs/REFINE-0148.pdf,publisher_403,none,https://doaj.org/article/14519b4fbc664537a590c87eaa24843f,,0.0,,missing_pdf,PDF file not found on disk
REFINE-0149,Apoptotic Proteins in the Temporal Cortex in Schizophrenia: High Bax/Bcl-2 Ratio Without Caspase-3 Activation,10.1176/appi.ajp.161.1.109,data/pdfs/REFINE-0149.pdf,publisher_403,none,https://doi.org/10.1176/appi.ajp.161.1.109,,0.0,,missing_pdf,PDF file not found on disk
REFINE-0150,Cortical thickness predicts the first onset of major depression in adolescence,10.1016/j.ijdevneu.2015.07.007,data/pdfs/REFINE-0150.pdf,publisher_403,none,https://doi.org/10.1016/j.ijdevneu.2015.07.007,,0.0,,missing_pdf,PDF file not found on disk
REFINE-0151,Non-verbal emotion communication training induces specific changes in brain function and structure,10.3389/fnhum.2013.00648,data/pdfs/REFINE-0151.pdf,downloaded,openalex,https://www.frontiersin.org/articles/10.3389/fnhum.2013.00648/pdf,Non-verbal emotion communication training induces,100.0,10.3389/fnhum.2013.00648,validated,DOI 10.3389/fnhum.2013.00648 found in PDF matches expected DOI 10.3389/fnhum.2013.00648
REFINE-0152,Prepartum and postpartum maternal depressive symptoms are related to children’s brain structure in preschool,10.1016/j.biopsych.2015.12.004,data/pdfs/REFINE-0152.pdf,repository_landing_page,none,,,0.0,,missing_pdf,PDF file not found on disk
REFINE-0153,Cerebral Benzodiazepine Receptors in Depressed Patients Measured with [123I]iomazenil SPECT,10.1016/s0006-3223(02)01788-2,data/pdfs/REFINE-0153.pdf,landing_page_unresolved,none,,,0.0,,missing_pdf,PDF file not found on disk
REFINE-0154,"Brain hyperintensity location determines outcome in the triad of impaired cognition, physical health and depressive symptoms: A cohort study in late life",10.1016/j.archger.2015.10.004,data/pdfs/REFINE-0154.pdf,downloaded,semantic_scholar,https://www.pure.ed.ac.uk/ws/files/24726334/Murray_AD_et_al_Triad_AGG_2016.pdf,Brain hyperintensity location determines outcome in the triad of,100.0,10.1016/j.archger.2015.10.004,validated,DOI 10.1016/j.archger.2015.10.004 found in PDF matches expected DOI 10.1016/j.archger.2015.10.004
REFINE-0155,Orbitofrontal cortex grey matter volume is related to children’s depressive symptoms,10.1016/j.nicl.2020.102395,data/pdfs/REFINE-0155.pdf,publisher_403,none,https://doaj.org/article/41a205dd38754671a376c446b6f307f1,,0.0,,missing_pdf,PDF file not found on disk
REFINE-0156,Dispositional mindfulness co-varies with smaller amygdala and caudate volumes in community adults,10.1371/journal.pone.0064574,data/pdfs/REFINE-0156.pdf,downloaded,openalex,https://journals.plos.org/plosone/article/file?id=10.1371/journal.pone.0064574&type=printable,Dispositional Mindfulness Co-Varies with Smaller,100.0,10.1371/journal.pone.0064574,validated,DOI 10.1371/journal.pone.0064574 found in PDF matches expected DOI 10.1371/journal.pone.0064574
REFINE-0157,Genetic patterning for child psychopathology is distinct from that for adults and implicates fetal cerebellar development,10.1038/s41593-023-01321-8,data/pdfs/REFINE-0157.pdf,downloaded,openalex_landing_page,https://static-content.springer.com/esm/art%3A10.1038%2Fs41593-023-01321-8/MediaObjects/41593_2023_1321_MOESM1_ESM.pdf,Genetic patterning for child,100.0,10.1038/s41593-023-01321-8,validated,DOI 10.1038/s41593-023-01321-8 found in PDF matches expected DOI 10.1038/s41593-023-01321-8
REFINE-0158,Subthreshold depression and regional brain volumes in young community adolescents,10.1016/j.jaac.2015.07.006,data/pdfs/REFINE-0158.pdf,pmc_fulltext_no_pdf,none,,,0.0,,missing_pdf,PDF file not found on disk
REFINE-0159,Depressive symptoms in cognitively unimpaired older adults are associated with lower structural and functional integrity in a frontolimbic network,10.1038/s41380-022-01772-8,data/pdfs/REFINE-0159.pdf,downloaded,openalex,https://www.nature.com/articles/s41380-022-01772-8.pdf,Depressive symptoms in cognitively unimpaired older adults,100.0,10.1038/s41380-022-01772-8,validated,DOI 10.1038/s41380-022-01772-8 found in PDF matches expected DOI 10.1038/s41380-022-01772-8
REFINE-0160,Cognitive-behavioral therapy increases prefrontal cortex gray matter in patients with chronic pain,10.1016/j.jpain.2013.07.020,data/pdfs/REFINE-0160.pdf,publisher_403,none,http://www.jpain.org/article/S1526590013011796/pdf,,0.0,,missing_pdf,PDF file not found on disk
REFINE-0161,Reduced thalamic volume in men with antisocial personality disorder or schizophrenia and a history of serious violence and childhood abuse,10.1016/j.eurpsy.2012.03.002,data/pdfs/REFINE-0161.pdf,publisher_403,none,https://orca.cardiff.ac.uk/id/eprint/74589/,,0.0,,missing_pdf,PDF file not found on disk
REFINE-0162,Morphometric changes of gray matter in Parkinson’s disease with depression: A voxel-based morphometry study,10.1002/mds.21765,data/pdfs/REFINE-0162.pdf,publisher_403,none,https://doi.org/10.1002/mds.21765,,0.0,,missing_pdf,PDF file not found on disk
REFINE-0163,Depression is associated with hippocampal volume loss in adults with HIV,10.1002/hbm.25451,data/pdfs/REFINE-0163.pdf,publisher_403,none,https://onlinelibrary.wiley.com/doi/pdfdirect/10.1002/hbm.25451,,0.0,,missing_pdf,PDF file not found on disk
REFINE-0164,Large-scale structural network change correlates with clinical response to rTMS in depression,10.1038/s41386-021-01256-3,data/pdfs/REFINE-0164.pdf,invalid_pdf,none,,,0.0,,missing_pdf,PDF file not found on disk
REFINE-0165,Tissue type-specific bioenergetic abnormalities in adults with major depression,10.1038/npp.2016.180,data/pdfs/REFINE-0165.pdf,invalid_pdf,none,,,0.0,,missing_pdf,PDF file not found on disk
REFINE-0166,Transient cognitive impairment and white matter hyperintensities in severely depressed older patients treated with electroconvulsive therapy,10.1016/j.jagp.2020.12.028,data/pdfs/REFINE-0166.pdf,downloaded,openalex,https://pure.amsterdamumc.nl/ws/files/201325390/Transient-cognitive-impairment-and-white-matter-hyperintensities-in-severely-depressed-older-patients-treated-with-elect.pdf,Transient Cognitive Impairment,100.0,10.1016/j.jagp.2020.12.028,validated,DOI 10.1016/j.jagp.2020.12.028 found in PDF matches expected DOI 10.1016/j.jagp.2020.12.028
REFINE-0167,Gray matter changes in late life depression—A structural MRI analysis,10.1038/sj.npp.1301655,data/pdfs/REFINE-0167.pdf,invalid_pdf,none,,,0.0,,missing_pdf,PDF file not found on disk
REFINE-0168,Impact of lingual gyrus volume on antidepressant response and neurocognitive functions in Major Depressive Disorder: A voxel-based morphometry study,10.1016/j.jad.2014.08.018,data/pdfs/REFINE-0168.pdf,publisher_403,none,https://nottingham-repository.worktribe.com/output/3794503,,0.0,,missing_pdf,PDF file not found on disk
REFINE-0169,Prolactin mediates the relationship between regional gray matter volume and postpartum depression symptoms,10.1016/j.jad.2022.01.051,data/pdfs/REFINE-0169.pdf,landing_page_unresolved,none,,,0.0,,missing_pdf,PDF file not found on disk
REFINE-0170,"Clinical, cortical thickness and neural activity predictors of future affective lability in youth at risk for bipolar disorder: Initial discovery and independent sample replication",10.1038/s41380-018-0273-4,data/pdfs/REFINE-0170.pdf,pmc_pdf_not_found,none,,,0.0,,missing_pdf,PDF file not found on disk
REFINE-0171,"Structural deficits in the emotion circuit and cerebellum are associated with depression, anxiety and cognitive dysfunction in methadone maintenance patients: A voxel-based morphometric study",10.1016/j.pscychresns.2011.05.009,data/pdfs/REFINE-0171.pdf,landing_page_unresolved,none,,,0.0,,missing_pdf,PDF file not found on disk
REFINE-0172,Anterior cingulate volume predicts response to cognitive behavioral therapy in major depressive disorder,10.1016/j.jad.2014.12.009,data/pdfs/REFINE-0172.pdf,landing_page_unresolved,none,,,0.0,,missing_pdf,PDF file not found on disk
REFINE-0173,A specific pattern of gray matter atrophy in Alzheimer’s disease with depression,10.1007/s00415-017-8603-z,data/pdfs/REFINE-0173.pdf,repository_landing_page,none,,,0.0,,missing_pdf,PDF file not found on disk
REFINE-0174,Morphometric analysis of vascular pathology in the orbitofrontal cortex of older subjects with major depression,10.1002/gps.3911,data/pdfs/REFINE-0174.pdf,publisher_403,none,https://doi.org/10.1002/gps.3911,,0.0,,missing_pdf,PDF file not found on disk
REFINE-0175,Astrocytic hypertrophy in anterior cingulate white matter of depressed suicides,10.1038/npp.2011.154,data/pdfs/REFINE-0175.pdf,invalid_pdf,none,,,0.0,,missing_pdf,PDF file not found on disk
REFINE-0176,Prefrontal-amygdala emotion regulation and depression in multiple sclerosis,10.1093/braincomms/fcac152,data/pdfs/REFINE-0176.pdf,publisher_403,none,https://academic.oup.com/braincomms/article-pdf/4/3/fcac152/44180628/fcac152.pdf,,0.0,,missing_pdf,PDF file not found on disk
REFINE-0177,The development of depressogenic self-schemas: Associations with children’s regional grey matter volume in ventrolateral prefrontal cortex,10.1017/s0954579421000341,data/pdfs/REFINE-0177.pdf,downloaded,openalex_landing_page,https://www.cambridge.org/core/services/aop-cambridge-core/content/view/CA15CA3B1571B7FB2CE001EA849E5064/S0954579421000341a.pdf/div-class-title-the-development-of-depressogenic-self-schemas-associations-with-children-s-regional-grey-matter-volume-in-ventrolateral-prefrontal-cortex-div.pdf,The development of depressogenic self-schemas: Associations with,100.0,10.1017/S0954579421000341,validated,DOI 10.1017/S0954579421000341 found in PDF matches expected DOI 10.1017/s0954579421000341
REFINE-0178,"Associations Between Daily Mood States and Brain Gray Matter Volume, Resting-State Functional Connectivity and Task-Based Activity in Healthy Adults",10.3389/fnhum.2018.00168,data/pdfs/REFINE-0178.pdf,downloaded,openalex,https://www.frontiersin.org/articles/10.3389/fnhum.2018.00168/pdf,published: 01 May 2018,38.1,10.3389/fnhum.2018.00168,validated,DOI 10.3389/fnhum.2018.00168 found in PDF matches expected DOI 10.3389/fnhum.2018.00168
REFINE-0179,Cortical thickness and VBM-DARTEL in late-life depression,10.1016/j.jad.2011.04.010,data/pdfs/REFINE-0179.pdf,landing_page_unresolved,none,,,0.0,,missing_pdf,PDF file not found on disk
REFINE-0180,"Patients with primary biliary cholangitis and fatigue present with depressive symptoms and selected cognitive deficits, but with normal attention performance and brain structure",10.1371/journal.pone.0190005,data/pdfs/REFINE-0180.pdf,downloaded,openalex,https://journals.plos.org/plosone/article/file?id=10.1371/journal.pone.0190005&type=printable,Patients with primary biliary cholangitis and,100.0,10.5061/dryad.,validated,Title similarity 100.0% >= 85% threshold
REFINE-0181,Gray matter reorganization underpinnings of antidepressant treatment of persistent depressive disorder,10.1016/j.euroneuro.2020.12.009,data/pdfs/REFINE-0181.pdf,landing_page_unresolved,none,,,0.0,,missing_pdf,PDF file not found on disk
REFINE-0182,Pattern of brain atrophy in elderly patients with depression revealed by voxel-based morphometry,10.1016/j.pscychresns.2007.12.018,data/pdfs/REFINE-0182.pdf,landing_page_unresolved,none,,,0.0,,missing_pdf,PDF file not found on disk
REFINE-0183,Depression and agitation factors are related to regional brain atrophy and faster longitudinal cognitive decline in mild cognitive impairment,10.3233/jad-230929,data/pdfs/REFINE-0183.pdf,publisher_403,none,https://doi.org/10.3233/jad-230929,,0.0,,missing_pdf,PDF file not found on disk
REFINE-0184,Depressive symptoms combined with auditory hallucinations are accompanied with severe gray matter brain impairments in patients with first-episode untreated schizophrenia – A pilot study in China,10.1016/j.neulet.2020.135033,data/pdfs/REFINE-0184.pdf,landing_page_unresolved,none,,,0.0,,missing_pdf,PDF file not found on disk
